{
  "schemaVersion": 1,
  "discipline": {
    "key": "digital_marketing",
    "label": "Digital marketing",
    "category": "market",
    "categoryLabel": "Sales, marketing & customer",
    "focus": "Ads, SEO and conversion tracking"
  },
  "pack": {
    "key": "sales-marketing",
    "reportTemplate": "creative",
    "registerKinds": [
      "Leads",
      "Campaigns",
      "Customers",
      "Metrics"
    ],
    "ladderDiscipline": {
      "proposed": "sales_marketing",
      "verifyIn": "lib/auto-populate.ts"
    }
  },
  "provenance": {
    "type": "proposed-seed",
    "sourceDocument": null,
    "reviewRequired": true,
    "reviewerRole": "experienced digital marketing practitioner",
    "note": "Starting seed written without a source document. Not professional, clinical, legal, financial or safety advice. A practitioner must review before use."
  },
  "method": {
    "resolveAtRuntime": "getMethodForDiscipline(pack, discipline)",
    "documentedSequence": null,
    "documentedIn": null
  },
  "surfaces": {
    "overview": {
      "path": "/dashboard/ops",
      "kpis": [
        {
          "id": "conversions",
          "label": "Conversions",
          "source": "ad_campaign_reports",
          "sourceType": "log",
          "aggregation": "sum",
          "defaultTarget": null,
          "computedBy": "code"
        },
        {
          "id": "campaigns_over_cost",
          "label": "Campaigns over cost",
          "source": "ad_campaign_reports",
          "sourceType": "log",
          "aggregation": "count",
          "defaultTarget": null,
          "computedBy": "code"
        },
        {
          "id": "seo_issues_open",
          "label": "SEO issues open",
          "source": "seo_checks",
          "sourceType": "log",
          "aggregation": "open_count",
          "defaultTarget": null,
          "computedBy": "code"
        },
        {
          "id": "seo_issues_fixed",
          "label": "SEO issues fixed",
          "source": "seo_checks",
          "sourceType": "log",
          "aggregation": "count",
          "defaultTarget": null,
          "computedBy": "code"
        }
      ],
      "recommendRules": [
        {
          "id": "spend_over_cap",
          "when": "spend over cap",
          "suggest": "pause or adjust",
          "deterministic": true
        },
        {
          "id": "seo_issue_open_over_14_days",
          "when": "SEO issue open over 14 days",
          "suggest": "fix",
          "deterministic": true
        }
      ]
    },
    "logs": {
      "path": "/dashboard/ops/logs",
      "entities": [
        {
          "key": "ad_campaign_reports",
          "label": "Ad campaign reports",
          "fields": [
            {
              "key": "period",
              "type": "text"
            },
            {
              "key": "platform",
              "type": "text"
            },
            {
              "key": "clicks",
              "type": "number"
            },
            {
              "key": "conversions",
              "type": "number"
            },
            {
              "key": "cost_status",
              "type": "enum",
              "values": [
                "within",
                "over"
              ]
            }
          ]
        },
        {
          "key": "seo_checks",
          "label": "Seo checks",
          "fields": [
            {
              "key": "check_date",
              "type": "date"
            },
            {
              "key": "page",
              "type": "text"
            },
            {
              "key": "issue",
              "type": "text"
            },
            {
              "key": "status",
              "type": "enum",
              "values": [
                "open",
                "fixed"
              ]
            }
          ]
        }
      ]
    },
    "registers": {
      "path": "/dashboard/registers",
      "items": [
        {
          "kind": "Leads",
          "track": [
            "digital leads"
          ]
        },
        {
          "kind": "Campaigns",
          "track": [
            "ad campaigns"
          ]
        },
        {
          "kind": "Customers",
          "track": [
            "audiences"
          ]
        },
        {
          "kind": "Metrics",
          "track": [
            "digital metrics"
          ]
        }
      ]
    },
    "playbooks": {
      "path": "/dashboard/playbooks",
      "seeds": [
        {
          "key": "daily_spend_check",
          "title": "Daily spend check",
          "frequency": "daily",
          "phasesFrom": "method"
        },
        {
          "key": "weekly_performance_review",
          "title": "Weekly performance review",
          "frequency": "weekly",
          "phasesFrom": "method"
        },
        {
          "key": "monthly_seo_audit",
          "title": "Monthly SEO audit",
          "frequency": "monthly",
          "phasesFrom": "method"
        }
      ]
    },
    "tasks": {
      "path": "/dashboard/tasks",
      "recurringTemplates": [
        {
          "title": "Daily spend check",
          "frequency": "daily",
          "playbookKey": "daily_spend_check"
        },
        {
          "title": "Weekly performance review",
          "frequency": "weekly",
          "playbookKey": "weekly_performance_review"
        },
        {
          "title": "Monthly SEO audit",
          "frequency": "monthly",
          "playbookKey": "monthly_seo_audit"
        }
      ]
    },
    "reports": {
      "path": "/dashboard/reports-work",
      "template": "creative",
      "cadences": [
        "daily",
        "weekly",
        "monthly"
      ],
      "sections": [
        "Summary",
        "Conversions",
        "Campaigns over cost",
        "SEO issues open",
        "SEO issues fixed",
        "Risks and recommendations",
        "Plan for next period"
      ]
    }
  },
  "ai": {
    "policy": {
      "level": "standard",
      "neverSendRegisterKinds": [],
      "neverSendEntities": [],
      "neverSendFields": [
        "passwords",
        "keys",
        "tokens",
        "personal identifiers"
      ],
      "numbers": "never produced or altered by the model; computed in code"
    },
    "agents": [
      {
        "id": "G0",
        "page": "/onboarding",
        "flavour": "classify an unmapped job title into this discipline (enum-validated; deterministic map wins)"
      },
      {
        "id": "G1",
        "page": "/dashboard/agent",
        "flavour": "extract register rows and playbook drafts for Digital marketing from a pasted procedure or handover"
      },
      {
        "id": "G2",
        "page": "/dashboard/tasks",
        "flavour": "triage a free-text request into task fields"
      },
      {
        "id": "G3",
        "page": "/dashboard/worklog",
        "flavour": "turn rough notes into work-log entries tagged to a method phase"
      },
      {
        "id": "G4",
        "page": "/dashboard/ops/logs",
        "flavour": "read pasted text into: ad_campaign_reports, seo_checks"
      },
      {
        "id": "G5",
        "page": "/dashboard/reports-work",
        "flavour": "draft summary and recommendation text only; numbers come from the server"
      },
      {
        "id": "G6",
        "page": "/dashboard/automation",
        "flavour": "draft rules from plain language; dry-run before enabling"
      },
      {
        "id": "G8",
        "page": "/dashboard/ops",
        "flavour": "turn deterministic rule facts into recommendation text"
      },
      {
        "id": "G11",
        "page": "/dashboard/playbooks",
        "flavour": "draft playbook phases from procedure text using the Digital marketing method"
      }
    ]
  },
  "needsConfirmation": [
    "KPI targets are unset (defaultTarget null): the owner and their manager must set them.",
    "Field names, enums and playbook titles are proposals: confirm against local practice."
  ]
}