{
  "schemaVersion": 1,
  "discipline": {
    "key": "marketing",
    "label": "Marketing",
    "category": "market",
    "categoryLabel": "Sales, marketing & customer",
    "focus": "Campaigns, content and results"
  },
  "pack": {
    "key": "sales-marketing",
    "reportTemplate": "creative",
    "registerKinds": [
      "Leads",
      "Campaigns",
      "Customers",
      "Metrics"
    ],
    "ladderDiscipline": {
      "proposed": "sales_marketing",
      "verifyIn": "lib/auto-populate.ts"
    }
  },
  "provenance": {
    "type": "proposed-seed",
    "sourceDocument": null,
    "reviewRequired": true,
    "reviewerRole": "experienced marketing practitioner",
    "note": "Starting seed written without a source document. Not professional, clinical, legal, financial or safety advice. A practitioner must review before use."
  },
  "method": {
    "resolveAtRuntime": "getMethodForDiscipline(pack, discipline)",
    "documentedSequence": null,
    "documentedIn": null
  },
  "surfaces": {
    "overview": {
      "path": "/dashboard/ops",
      "kpis": [
        {
          "id": "campaigns_reported",
          "label": "Campaigns reported",
          "source": "campaign_results",
          "sourceType": "log",
          "aggregation": "count",
          "defaultTarget": null,
          "computedBy": "code"
        },
        {
          "id": "campaigns_over_budget",
          "label": "Campaigns over budget",
          "source": "campaign_results",
          "sourceType": "log",
          "aggregation": "count",
          "defaultTarget": null,
          "computedBy": "code"
        },
        {
          "id": "posts_published",
          "label": "Posts published",
          "source": "content_posts",
          "sourceType": "log",
          "aggregation": "count",
          "defaultTarget": null,
          "computedBy": "code"
        },
        {
          "id": "leads_generated",
          "label": "Leads generated",
          "source": "campaign_results",
          "sourceType": "log",
          "aggregation": "sum",
          "defaultTarget": null,
          "computedBy": "code"
        }
      ],
      "recommendRules": [
        {
          "id": "campaign_over_budget",
          "when": "campaign over budget",
          "suggest": "review spend",
          "deterministic": true
        },
        {
          "id": "no_result_recorded_for_a_live_campaign",
          "when": "no result recorded for a live campaign",
          "suggest": "record",
          "deterministic": true
        }
      ]
    },
    "logs": {
      "path": "/dashboard/ops/logs",
      "entities": [
        {
          "key": "campaign_results",
          "label": "Campaign results",
          "fields": [
            {
              "key": "period",
              "type": "text"
            },
            {
              "key": "campaign",
              "type": "text"
            },
            {
              "key": "channel",
              "type": "text"
            },
            {
              "key": "leads_generated_count",
              "type": "number"
            },
            {
              "key": "spend_status",
              "type": "enum",
              "values": [
                "within",
                "over"
              ]
            }
          ]
        },
        {
          "key": "content_posts",
          "label": "Content posts",
          "fields": [
            {
              "key": "post_date",
              "type": "date"
            },
            {
              "key": "channel",
              "type": "text"
            },
            {
              "key": "topic",
              "type": "text"
            }
          ]
        }
      ]
    },
    "registers": {
      "path": "/dashboard/registers",
      "items": [
        {
          "kind": "Leads",
          "track": [
            "marketing leads"
          ]
        },
        {
          "kind": "Campaigns",
          "track": [
            "campaigns"
          ]
        },
        {
          "kind": "Customers",
          "track": [
            "segments"
          ]
        },
        {
          "kind": "Metrics",
          "track": [
            "marketing metrics"
          ]
        }
      ]
    },
    "playbooks": {
      "path": "/dashboard/playbooks",
      "seeds": [
        {
          "key": "weekly_campaign_review",
          "title": "Weekly campaign review",
          "frequency": "weekly",
          "phasesFrom": "method"
        },
        {
          "key": "monthly_results_report",
          "title": "Monthly results report",
          "frequency": "monthly",
          "phasesFrom": "method"
        },
        {
          "key": "quarterly_plan_review",
          "title": "Quarterly plan review",
          "frequency": "quarterly",
          "phasesFrom": "method"
        }
      ]
    },
    "tasks": {
      "path": "/dashboard/tasks",
      "recurringTemplates": [
        {
          "title": "Weekly campaign review",
          "frequency": "weekly",
          "playbookKey": "weekly_campaign_review"
        },
        {
          "title": "Monthly results report",
          "frequency": "monthly",
          "playbookKey": "monthly_results_report"
        },
        {
          "title": "Quarterly plan review",
          "frequency": "quarterly",
          "playbookKey": "quarterly_plan_review"
        }
      ]
    },
    "reports": {
      "path": "/dashboard/reports-work",
      "template": "creative",
      "cadences": [
        "daily",
        "weekly",
        "monthly"
      ],
      "sections": [
        "Summary",
        "Campaigns reported",
        "Campaigns over budget",
        "Posts published",
        "Leads generated",
        "Risks and recommendations",
        "Plan for next period"
      ]
    }
  },
  "ai": {
    "policy": {
      "level": "standard",
      "neverSendRegisterKinds": [],
      "neverSendEntities": [],
      "neverSendFields": [
        "passwords",
        "keys",
        "tokens",
        "personal identifiers"
      ],
      "numbers": "never produced or altered by the model; computed in code"
    },
    "agents": [
      {
        "id": "G0",
        "page": "/onboarding",
        "flavour": "classify an unmapped job title into this discipline (enum-validated; deterministic map wins)"
      },
      {
        "id": "G1",
        "page": "/dashboard/agent",
        "flavour": "extract register rows and playbook drafts for Marketing from a pasted procedure or handover"
      },
      {
        "id": "G2",
        "page": "/dashboard/tasks",
        "flavour": "triage a free-text request into task fields"
      },
      {
        "id": "G3",
        "page": "/dashboard/worklog",
        "flavour": "turn rough notes into work-log entries tagged to a method phase"
      },
      {
        "id": "G4",
        "page": "/dashboard/ops/logs",
        "flavour": "read pasted text into: campaign_results, content_posts"
      },
      {
        "id": "G5",
        "page": "/dashboard/reports-work",
        "flavour": "draft summary and recommendation text only; numbers come from the server"
      },
      {
        "id": "G6",
        "page": "/dashboard/automation",
        "flavour": "draft rules from plain language; dry-run before enabling"
      },
      {
        "id": "G8",
        "page": "/dashboard/ops",
        "flavour": "turn deterministic rule facts into recommendation text"
      },
      {
        "id": "G11",
        "page": "/dashboard/playbooks",
        "flavour": "draft playbook phases from procedure text using the Marketing method"
      }
    ]
  },
  "needsConfirmation": [
    "KPI targets are unset (defaultTarget null): the owner and their manager must set them.",
    "Field names, enums and playbook titles are proposals: confirm against local practice."
  ]
}