{
  "schemaVersion": 1,
  "discipline": {
    "key": "treasury",
    "label": "Treasury",
    "category": "finance",
    "categoryLabel": "Finance, audit & commercial",
    "focus": "Cash, funding and exposure management"
  },
  "pack": {
    "key": "finance",
    "reportTemplate": "assurance",
    "registerKinds": [
      "Accounts",
      "Audits",
      "Compliance",
      "Financial reports"
    ],
    "ladderDiscipline": {
      "proposed": "finance",
      "verifyIn": "lib/auto-populate.ts"
    }
  },
  "provenance": {
    "type": "proposed-seed",
    "sourceDocument": null,
    "reviewRequired": true,
    "reviewerRole": "qualified accountant",
    "note": "Starting seed written without a source document. Not professional, clinical, legal, financial or safety advice. A practitioner must review before use."
  },
  "method": {
    "resolveAtRuntime": "getMethodForDiscipline(pack, discipline)",
    "documentedSequence": null,
    "documentedIn": null
  },
  "surfaces": {
    "overview": {
      "path": "/dashboard/ops",
      "kpis": [
        {
          "id": "positions_reconciled",
          "label": "Positions reconciled",
          "source": "cash_positions",
          "sourceType": "log",
          "aggregation": "count",
          "defaultTarget": null,
          "computedBy": "code"
        },
        {
          "id": "forecast_variances",
          "label": "Forecast variances",
          "source": "cash_positions",
          "sourceType": "log",
          "aggregation": "count",
          "defaultTarget": null,
          "computedBy": "code"
        },
        {
          "id": "funding_reviews",
          "label": "Funding reviews",
          "source": "funding_reviews",
          "sourceType": "log",
          "aggregation": "count",
          "defaultTarget": null,
          "computedBy": "code"
        },
        {
          "id": "policy_items",
          "label": "Policy items",
          "source": "compliance",
          "sourceType": "register",
          "aggregation": "count",
          "defaultTarget": null,
          "computedBy": "code"
        }
      ],
      "recommendRules": [
        {
          "id": "position_unreconciled",
          "when": "position unreconciled",
          "suggest": "reconcile",
          "deterministic": true
        },
        {
          "id": "forecast_variance_over_threshold",
          "when": "forecast variance over threshold",
          "suggest": "review",
          "deterministic": true
        }
      ]
    },
    "logs": {
      "path": "/dashboard/ops/logs",
      "entities": [
        {
          "key": "cash_positions",
          "label": "Cash positions",
          "fields": [
            {
              "key": "position_date",
              "type": "date"
            },
            {
              "key": "account_ref",
              "type": "number"
            },
            {
              "key": "reconciled",
              "type": "enum",
              "values": [
                "yes",
                "no"
              ]
            },
            {
              "key": "forecast_variance_flag",
              "type": "enum",
              "values": [
                "within",
                "over"
              ]
            }
          ]
        },
        {
          "key": "funding_reviews",
          "label": "Funding reviews",
          "fields": [
            {
              "key": "review_date",
              "type": "date"
            },
            {
              "key": "exposure_ref",
              "type": "text"
            },
            {
              "key": "action",
              "type": "text"
            }
          ]
        }
      ]
    },
    "registers": {
      "path": "/dashboard/registers",
      "items": [
        {
          "kind": "Accounts",
          "track": [
            "bank and funding accounts"
          ]
        },
        {
          "kind": "Compliance",
          "track": [
            "treasury policy limits"
          ]
        },
        {
          "kind": "Financial reports",
          "track": [
            "cash reports"
          ]
        }
      ]
    },
    "playbooks": {
      "path": "/dashboard/playbooks",
      "seeds": [
        {
          "key": "daily_cash_position",
          "title": "Daily cash position",
          "frequency": "daily",
          "phasesFrom": "method"
        },
        {
          "key": "weekly_forecast_review",
          "title": "Weekly forecast review",
          "frequency": "weekly",
          "phasesFrom": "method"
        },
        {
          "key": "monthly_exposure_review",
          "title": "Monthly exposure review",
          "frequency": "monthly",
          "phasesFrom": "method"
        }
      ]
    },
    "tasks": {
      "path": "/dashboard/tasks",
      "recurringTemplates": [
        {
          "title": "Daily cash position",
          "frequency": "daily",
          "playbookKey": "daily_cash_position"
        },
        {
          "title": "Weekly forecast review",
          "frequency": "weekly",
          "playbookKey": "weekly_forecast_review"
        },
        {
          "title": "Monthly exposure review",
          "frequency": "monthly",
          "playbookKey": "monthly_exposure_review"
        }
      ]
    },
    "reports": {
      "path": "/dashboard/reports-work",
      "template": "assurance",
      "cadences": [
        "daily",
        "weekly",
        "monthly"
      ],
      "sections": [
        "Summary",
        "Positions reconciled",
        "Forecast variances",
        "Funding reviews",
        "Policy items",
        "Risks and recommendations",
        "Plan for next period"
      ]
    }
  },
  "ai": {
    "policy": {
      "level": "restricted",
      "neverSendRegisterKinds": [
        "Accounts"
      ],
      "neverSendEntities": [
        "cash_positions"
      ],
      "neverSendFields": [
        "passwords",
        "keys",
        "tokens",
        "personal identifiers",
        "amounts and balances"
      ],
      "numbers": "never produced or altered by the model; computed in code"
    },
    "agents": [
      {
        "id": "G0",
        "page": "/onboarding",
        "flavour": "classify an unmapped job title into this discipline (enum-validated; deterministic map wins)"
      },
      {
        "id": "G1",
        "page": "/dashboard/agent",
        "flavour": "extract register rows and playbook drafts for Treasury from a pasted procedure or handover"
      },
      {
        "id": "G2",
        "page": "/dashboard/tasks",
        "flavour": "triage a free-text request into task fields"
      },
      {
        "id": "G3",
        "page": "/dashboard/worklog",
        "flavour": "turn rough notes into work-log entries tagged to a method phase"
      },
      {
        "id": "G4",
        "page": "/dashboard/ops/logs",
        "flavour": "read pasted text into: funding_reviews"
      },
      {
        "id": "G5",
        "page": "/dashboard/reports-work",
        "flavour": "draft summary and recommendation text only; numbers come from the server"
      },
      {
        "id": "G6",
        "page": "/dashboard/automation",
        "flavour": "draft rules from plain language; dry-run before enabling"
      },
      {
        "id": "G8",
        "page": "/dashboard/ops",
        "flavour": "turn deterministic rule facts into recommendation text"
      },
      {
        "id": "G11",
        "page": "/dashboard/playbooks",
        "flavour": "draft playbook phases from procedure text using the Treasury method"
      }
    ]
  },
  "needsConfirmation": [
    "KPI targets are unset (defaultTarget null): the owner and their manager must set them.",
    "Field names, enums and playbook titles are proposals: confirm against local practice."
  ]
}