{
  "schemaVersion": 1,
  "discipline": {
    "key": "administration",
    "label": "Administration",
    "category": "people",
    "categoryLabel": "People, administration & governance",
    "focus": "Document handling, requests and office tasks"
  },
  "pack": {
    "key": "hr",
    "reportTemplate": "general",
    "registerKinds": [
      "Employee records",
      "Policies",
      "Training",
      "Compliance"
    ],
    "ladderDiscipline": {
      "proposed": "hr",
      "verifyIn": "lib/auto-populate.ts"
    }
  },
  "provenance": {
    "type": "proposed-seed",
    "sourceDocument": null,
    "reviewRequired": true,
    "reviewerRole": "experienced administration practitioner",
    "note": "Starting seed written without a source document. Not professional, clinical, legal, financial or safety advice. A practitioner must review before use."
  },
  "method": {
    "resolveAtRuntime": "getMethodForDiscipline(pack, discipline)",
    "documentedSequence": null,
    "documentedIn": null
  },
  "surfaces": {
    "overview": {
      "path": "/dashboard/ops",
      "kpis": [
        {
          "id": "requests_completed",
          "label": "Requests completed",
          "source": "document_requests",
          "sourceType": "log",
          "aggregation": "count",
          "defaultTarget": null,
          "computedBy": "code"
        },
        {
          "id": "requests_open",
          "label": "Requests open",
          "source": "document_requests",
          "sourceType": "log",
          "aggregation": "open_count",
          "defaultTarget": null,
          "computedBy": "code"
        },
        {
          "id": "tasks_done",
          "label": "Tasks done",
          "source": "office_tasks",
          "sourceType": "log",
          "aggregation": "count",
          "defaultTarget": null,
          "computedBy": "code"
        },
        {
          "id": "procedures_documented",
          "label": "Procedures documented",
          "source": "policies",
          "sourceType": "register",
          "aggregation": "count",
          "defaultTarget": null,
          "computedBy": "code"
        }
      ],
      "recommendRules": [
        {
          "id": "request_open_over_3_days",
          "when": "request open over 3 days",
          "suggest": "chase",
          "deterministic": true
        },
        {
          "id": "filing_backlog_over_a_week",
          "when": "filing backlog over a week",
          "suggest": "clear",
          "deterministic": true
        }
      ]
    },
    "logs": {
      "path": "/dashboard/ops/logs",
      "entities": [
        {
          "key": "document_requests",
          "label": "Document requests",
          "fields": [
            {
              "key": "received_date",
              "type": "date"
            },
            {
              "key": "type",
              "type": "text"
            },
            {
              "key": "status",
              "type": "enum",
              "values": [
                "open",
                "done"
              ]
            }
          ]
        },
        {
          "key": "office_tasks",
          "label": "Office tasks",
          "fields": [
            {
              "key": "task_date",
              "type": "date"
            },
            {
              "key": "task",
              "type": "text"
            },
            {
              "key": "status",
              "type": "enum",
              "values": [
                "open",
                "done"
              ]
            }
          ]
        }
      ]
    },
    "registers": {
      "path": "/dashboard/registers",
      "items": [
        {
          "kind": "Employee records",
          "track": [
            "office records (codes only)"
          ]
        },
        {
          "kind": "Policies",
          "track": [
            "office procedures"
          ]
        },
        {
          "kind": "Training",
          "track": [
            "admin training"
          ]
        },
        {
          "kind": "Compliance",
          "track": [
            "records compliance"
          ]
        }
      ]
    },
    "playbooks": {
      "path": "/dashboard/playbooks",
      "seeds": [
        {
          "key": "daily_inbox_and_requests",
          "title": "Daily inbox and requests",
          "frequency": "daily",
          "phasesFrom": "method"
        },
        {
          "key": "weekly_filing_check",
          "title": "Weekly filing check",
          "frequency": "weekly",
          "phasesFrom": "method"
        },
        {
          "key": "monthly_supplies_review",
          "title": "Monthly supplies review",
          "frequency": "monthly",
          "phasesFrom": "method"
        }
      ]
    },
    "tasks": {
      "path": "/dashboard/tasks",
      "recurringTemplates": [
        {
          "title": "Daily inbox and requests",
          "frequency": "daily",
          "playbookKey": "daily_inbox_and_requests"
        },
        {
          "title": "Weekly filing check",
          "frequency": "weekly",
          "playbookKey": "weekly_filing_check"
        },
        {
          "title": "Monthly supplies review",
          "frequency": "monthly",
          "playbookKey": "monthly_supplies_review"
        }
      ]
    },
    "reports": {
      "path": "/dashboard/reports-work",
      "template": "general",
      "cadences": [
        "daily",
        "weekly",
        "monthly"
      ],
      "sections": [
        "Summary",
        "Requests completed",
        "Requests open",
        "Tasks done",
        "Procedures documented",
        "Risks and recommendations",
        "Plan for next period"
      ]
    }
  },
  "ai": {
    "policy": {
      "level": "restricted",
      "neverSendRegisterKinds": [
        "Employee records"
      ],
      "neverSendEntities": [],
      "neverSendFields": [
        "passwords",
        "keys",
        "tokens",
        "personal identifiers",
        "amounts and balances"
      ],
      "numbers": "never produced or altered by the model; computed in code"
    },
    "agents": [
      {
        "id": "G0",
        "page": "/onboarding",
        "flavour": "classify an unmapped job title into this discipline (enum-validated; deterministic map wins)"
      },
      {
        "id": "G1",
        "page": "/dashboard/agent",
        "flavour": "extract register rows and playbook drafts for Administration from a pasted procedure or handover"
      },
      {
        "id": "G2",
        "page": "/dashboard/tasks",
        "flavour": "triage a free-text request into task fields"
      },
      {
        "id": "G3",
        "page": "/dashboard/worklog",
        "flavour": "turn rough notes into work-log entries tagged to a method phase"
      },
      {
        "id": "G4",
        "page": "/dashboard/ops/logs",
        "flavour": "read pasted text into: document_requests, office_tasks"
      },
      {
        "id": "G5",
        "page": "/dashboard/reports-work",
        "flavour": "draft summary and recommendation text only; numbers come from the server"
      },
      {
        "id": "G6",
        "page": "/dashboard/automation",
        "flavour": "draft rules from plain language; dry-run before enabling"
      },
      {
        "id": "G8",
        "page": "/dashboard/ops",
        "flavour": "turn deterministic rule facts into recommendation text"
      },
      {
        "id": "G11",
        "page": "/dashboard/playbooks",
        "flavour": "draft playbook phases from procedure text using the Administration method"
      }
    ]
  },
  "needsConfirmation": [
    "KPI targets are unset (defaultTarget null): the owner and their manager must set them.",
    "Field names, enums and playbook titles are proposals: confirm against local practice."
  ]
}